
EVTTITLEck2expanded.0003;United Kingdom;United Kingdom;United Kingdom;;United Kingdom;;;;;;;;;x;
 
EVTDESCck2expanded.0003;The Crowns of England, Scotland, Ireland, and Wales have finally been united under a single monarch. The new state has been proclaimed the United Kingdom, and it's coat of arms bears the sigils of the now united kingdoms.;The Crowns of England, Scotland, Ireland, and Wales have finally been united under a single monarch. The new state has been proclaimed the United Kingdom, and it's coat of arms bears the sigils of the now united kingdoms.;The Crowns of England, Scotland, Ireland, and Wales have finally been united under a single monarch. The new state has been proclaimed the United Kingdom, and it's coat of arms bears the sigils of the now united kingdoms.;;The Crowns of England, Scotland, Ireland, and Wales have finally been united under a single monarch. The new state has been proclaimed the United Kingdom, and it's coat of arms bears the sigils of the now united kingdoms.;;;;;;;;;x;
 
EVTOPTION1ck2expanded.0003;May the United Kingdom last forever.;May the United Kingdom last forever.;May the United Kingdom last forever.;;May the United Kingdom last forever.;;;;;;;;;x;
  
EVTTITLEck2expanded.0013;Kingdom of Prussia;Kingdom of Prussia;Kingdom of Prussia;;Kingdom of Prussia;;;;;;;;;x;
 
EVTDESCck2expanded.0013;The Kingdom of Prussia promises to unite the Prussian people under a single crown. Europe and the Levant will yield as the Prussian flag marches forth across the battlefield.;The Kingdom of Prussia promises to unite the Prussian people under a single crown. Europe and the Levant will yield as the Prussian flag marches forth across the battlefield.;The Kingdom of Prussia promises to unite the Prussian people under a single crown. Europe and the Levant will yield as the Prussian flag marches forth across the battlefield.;;The Kingdom of Prussia promises to unite the Prussian people under a single crown. Europe and the Levant will yield as the Prussian flag marches forth across the battlefield.;;;;;;;;;x;
 
EVTOPTION1ck2expanded.0013;Glory to the grand and holy Kingdom of Prussia!;Glory to the grand and holy Kingdom of Prussia!;Glory to the grand and holy Kingdom of Prussia!;;Glory to the grand and holy Kingdom of Prussia!;;;;;;;;;x;

form_united_kingdom;Form the United Kingdom;Form the United Kingdom;Form the United Kingdom;;Form the United Kingdom;;;;;;;;;x;
 
form_united_kingdom_desc;With the Crowns of England, Scotland, Ireland, and Wales under a single monarch, it is time to declare a unified state.;With the Crowns of England, Scotland, Ireland, and Wales under a single monarch, it is time to declare a unified state.;With the Crowns of England, Scotland, Ireland, and Wales under a single monarch, it is time to declare a unified state.;;With the Crowns of England, Scotland, Ireland, and Wales under a single monarch, it is time to declare a unified state.;;;;;;;;;x;

form_prussia;Form the Kingdom of Prussia;Form the Kingdom of Prussia;Form the Kingdom of Prussia;;Form the Kingdom of Prussia;;;;;;;;;x;
 
form_prussia_desc;The Prussian people seek unity under the crown of Prussia.;The Prussian people seek unity under the crown of Prussia.;The Prussian people seek unity under the crown of Prussia.;;The Prussian people seek unity under the crown of Prussia.;;;;;;;;;x;
